"prod","title","format","stars","comment"
"UE-Wireless-Bluetooth-Waterproof-Shockproof","Fantastic sound from a hardy, waterproof, rugged speaker!","Style: Cherrybomb Edition",5,"I absolutely love my new UE Boom 2 Wireless Bluetooth speaker!  I did lots of research and was thinking about getting a Bose, but I am so happy I got this one!.  I got this one as it seemed more rugged.  It is waterproof and will be great to take camping and other places with me.  I love that it can team with other peoples' UE Boom 2's.  It has a fantastic sound to it; much better than I would have expected.  I cannot imagine Boise being that much better.  I've heard the sound from the Boise is better, but the sound and volume capacity on this one are fantastic!  It is easy to sync with  and easy to use!  It has such fun colors too!"
"UE-Wireless-Bluetooth-Waterproof-Shockproof","Awesome. Just awesome.","Style: Phantom Edition",5,"I absolutely adore the Boom 2. I am using these in small conference room spaces currently for webinars and other web conferencing. The sound quality, both in and out, is great. The ability to pair two has made these viable in larger spaces and has helped us limit the need to speak louder than normal for others to hear on the other end of a web call. Plus, when it's time to put on some of our favorite jams, they thump with the best of them."
"UE-Wireless-Bluetooth-Waterproof-Shockproof","Amazing sound and range","Style: Phantom Edition",5,"I received this speaker through a deal with Verizon.  This speaker syncs quickly with our iPad 2, Droid turbo, and Moto x.  The range is fantastic.  I can leave my phone in any room in our house and take the speaker to any other room and even outside and it stays connected.  I'm not an audiophile but in my opinion the sound is great.  Music sounds amazing and audio books sound like the narrator is sitting in the room with you.  It has a nice feature where it will turn off automatically if you are no longer listening to anything so no more battery drain!  The price is a bit higher than I would have paid had I not gotten a deal but I'm very happy with this speaker!"
"UE-Wireless-Bluetooth-Waterproof-Shockproof","So worth it!","Style: Tropical Edition",5,"I was a little leery about paying this much money for a ""smallish"" Bluetooth speaker. But, these seemed to be well-regarded, and I wanted a new speaker to take on a week's vacation with me.Soooooo glad I got this thing! The sound is great - clear sound and enough bass to fill a good sized room easily! The battery lasted a whopping long time (using it several hours a day throughout the week's vacation, and I only had to recharge towards the end of the week)! The thing feels very tough and I'm digging the funky color-combo I got mine in.I traded up from about a $40 Bluetooth speaker that's probably half the size of this thing. But I think I got sound that's way more than twice as good as what I had before! I think this thing is worth every penny I paid for it!"
"UE-Wireless-Bluetooth-Waterproof-Shockproof","Fantastic sound and build quality","Style: Yeti Edition",5,"The sound from this BT speaker is fantastic!  Crisp highs, great mids and vocals, and nice bass (although this would be the weakest range since this is not a large speaker, but still very good).  I have been impressed with just how good it really sounds.  It's built tough, syncs quickly, and is very portable.  Battery life seems to be as UE has stated.  I have no complaints and only praise for this speaker.  Would defnitely turn around and buy another without question."
"UE-Wireless-Bluetooth-Waterproof-Shockproof","Love it!!","Style: Phantom Edition",5,"So I just picked this up 2 days ago and I love it!! I have been a fan on the original UE boom for about 2 years and didn't realized they released a new model. Right when I found out I could not wait and instead I went to a local store to pick it up. Normally I would buy through amazon but could not wait for shipment to arrive. Lets just say there is a difference! The sound is a little bit more crisp and when you do compare between the old model and new of the UE boom you notice that it is louder. This is from just comparing it for about 5-10 minutes. Also I am not an expert or anything. But I can tell a difference in the sound quality and also the loudness. I am pretty happy with it so far.  It feels very sturdy and is similar size to the previous model. The only thing I would say is I am not sure about the battery life. The original UE boom they said it last about 15 hours but that is playing low music. I play mine pretty loud normally because I am at social events and it last about 3 hours. Well now this new model is more powerful and even louder so lets see how long the battery life will be. Either way I am happy with it and would recommend."
"UE-Wireless-Bluetooth-Waterproof-Shockproof","UE Boom 2 Speaker Provides, Rich, Full, Stereo Sound on the go! Great Battery Life! A Must Have!","Style: Phantom Edition",5,"*************Update 2/14/16*******************************After less than 6 months, this speaker will no longer hold a charge. Amazon doesn't allow changes in the ratings, but I can no longer recommend this product. It is ridiculous that a supposed well made product can't last 6 months. Find another speaker & skip this.This Logitech Wireless Bluetooth Speaker is awesome! It arrives in a nice tube tucked inside an outer sleeve. The tube opens to show the speaker on one side and a compartment containing an informational insert, charging cable and adapter on the other. The speaker itself weighs only a few pounds and is very comfortable to hold in your hands. The soft rubber grip is very comfortable. It is also easy to clean and waterproof. It turns on by pressing the LED indentation at the top. A sound like bongo drums alerts you that the speaker is on. There is a second small round indentation above the LED turns the Bluetooth feature on. There is a companion app that you can download to provide interaction with the speaker. The app is fantastic! You can check the battery status (you are supposed to be able to check on the speaker itself by pressing on the front, but I could not get the right combination.) in app and it also shows next to my battery icon on my phone. The app gives instructions, allows you to connect to several speakers at one time, balance the EQ, set alarms and more. It also controls updates, which are wireless. Updating requires your device to be near and only take a few minutes, with the speaker restarting soon after. Pairing is easy and smooth. The sound is incredible! Rich, full, stereo sound is wonderful! I use mine at work since the speaker died and it sounds incredible. The battery life is pegged at 15 hours. I play mine for about 7 hours at work and it uses little power. I now use this more than my old Sony that I used with my old iPhone 4. Old iPhones can be great for music, I use them for music, like an iPod. Lightweight and easy to carry and use, This speaker is awesome! I didn't think I would like it, but I really love this. I highly recommend this."
"UE-Wireless-Bluetooth-Waterproof-Shockproof","Almost Perfect","Style: Phantom Edition",4,"PROS:-Loud!-Waterproof-Tough-Compact - This thing is hardly bigger than my Braven 570, but its 3x as loud-App with great features-Ability to pair 2 speakers together-GREAT Bluetooth range-Crazy battery lifeCONS:-At volumes >85% the bass really falls off and distortion starts to increase-At full volume the speaker attempts to reduce distortion by suppressing some sounds, which effectively distorts the sound anyway-Speaker has to stand on its end, which is not very stable. You can lay it on its side, but then it rolls around very easily. Really wish it had some sort of kickstand or something.-(very minor) The packaging it comes in is obnoxiously large and overdone. They could probably reduce the price by $5 by slimming down the packaging.VERDICT:-Lacks the amazing sound quality of the Bose Soundlink Mini (I've seen reviews stating they have the same sound quality), but is probably the better choice if you ever plan to take your speaker around. It's insanely loud for its size, has gread app support, and is pretty much lifeproof. I was a tiny bit let down by the lack of bass at full volume, but full volume is so loud I will hardly ever turn it up that loud. For $150, this speaker is 100% worth it."
"UE-Wireless-Bluetooth-Waterproof-Shockproof","Solid product","Style: Green Machine Edition",4,"Many reviews of portable speakers have this as a top consideration, which is why I did. It does suit a very cool, portable, solid, and multi-useful product.The sound is fine, not excellent. I'm a music guy, so others who aren't so discernible would be fine. Doesn't sound as good as my not-so-portable Bose; but therein lies the difference."
"UE-Wireless-Bluetooth-Waterproof-Shockproof","Red UE Boom 2","Style: Cherrybomb Edition",5,"This UE BOOM 2 is awesome. I ordered the Red one for my husband as a gift t o replace his beats pill. He loves it. I got the 2 year service protection plan with it and I also got him a case too since he is rough on stuff. We first saw the speaker at an AT&T store for about $20 more and it only came in one color (black). I am glad that I checked on Amazon and realized that there are other color options."
"UE-Wireless-Bluetooth-Waterproof-Shockproof","These are not inexpensive, but you WILL NOT be disappointed. This is an amazing piece of technology","Style: BrainFreeze Edition",5,"This UE Boom 2 is possibly the best unit available for those looking for quality, ruggedness and style. As at home on a table in your living room as on a stump at your next camp out. Simply an amazing piece of technology. The UE Boom 2 some features that the original does not. Full IPX waterproof vs water resistant + more."
"UE-Wireless-Bluetooth-Waterproof-Shockproof","Really nice... if you're using the UE phone app.","Style: Phantom Edition",4,"A couple of points I haven't seen mentioned in anyone else's review...1 - The speaker is actually pretty slick, but only after you fire up the UE Android app. It offers you several audio presets, but to really hear it sing you need to tinker around with the equalizer. The speaker is muddy and under-whelming without it.2 - The equalizer only works while connected via Bluetooth. If you'd hoped to plug in a cable and get crisp tunes you're going to be disappointed. The speaker needs to connect wirelessly in order for the settings to have an effect. The second I click off my phone, or switch to another BT device, the defaults kick in and I'm back to muffled sound. Logitech says there's no work-around for this.3 - The UE app allows you to choose whether you want to send call audio and/or media audio to the speaker. Unfortunately, if both are turned off, the speaker disconnects and I lose the equalizer again. That means that whenever my phone reports a new text message, the audio I'm pushing via cable gets interrupted. I have to pause the music and restart it to resume playback.3 - The speaker powers off if it sits dormant for about 15min. I'm in a customer-service business and frequently have to pause my music to take a phone call or have a conversation. That means every time I sit back down, I have to power my speaker back up. No way to disable this feature.4 - Volume is terrific.5 - Battery life is exceptional.6 - Construction is solid and I don't fear incurring damage from this guy bouncing around my backpack.7 - Speaker must be stood upright, and sounds best when the keys are facing you. Would have been nice for Logitech to include a stand of some kind that would prevent knocking it over so easily, or at least let us lay it down.SUMMARY: It's a good addition to my traveling workstation, but some of the points made above have been mildly irritating. With the equalizer effects, I love this thing. Without that, I'd have felt cheated to pay so much for such mediocre sound (defaults)."
"UE-Wireless-Bluetooth-Waterproof-Shockproof","Love it","Style: BrainFreeze Edition",5,"Amazing sound. Insane battery life + waterproof. What more could one ask for! There more- I aboaultely Love the ue boom  app that lets you pair speakers+ Remotely switch on and off the speaker , set the equaliser and set an alarm through the speaker. Speaker phone needs some working on - there's some echoing ( I'm sure that'll be fixed son with an update). Would highly recommend this speaker"
"UE-Wireless-Bluetooth-Waterproof-Shockproof","Bluetooth Blast","Style: Phantom Edition",5,"After buying the two Rolls for travel.I was very pleased with this line of speakers.So I ordered one Boom 2.After listening to the Boom 2,I had to get another one so I can sync them and have one on each side of the bed.Great Sound and solid build makes me want to give this speaker a great review.Would recommend to anyone."
"UE-Wireless-Bluetooth-Waterproof-Shockproof","A Worthy Upgrade to an Already-Great Product","Style: Tropical Edition",5,"Over the past few weeks, I’ve been listening to the current-generation of Ultimate Ears’ Bluetooth Speaker lineup; the UE Megaboom, UE Boom2, and UE Roll. This comes after owning the original UE Boom for about two years, and listening to is almost daily in my car, at home, in my office, and in parking lots while putting on ski gear. That’s to say, I have a lot of experience with the Boom, and know how it sounds. First, the flagship of the line is the original Boom – called the Boom2 in its current generation. It’s mid-sized in the lineup, and straddles the line between portability and sound quality.The cool thing about the Boom2 is it’s broad appeal to a bunch of audiences. The speaker is small and portable, so makes a great travel speaker if weight isn’t your primary concern. Think travel like car camping, road trips, tour groups (the kind with rolling luggage, tour busses), etc. The speaker is rugged, coated in rubber, and waterproof – so it’s great for busy families with rowdy kids knocking things over, great to drag around the vacation house out to the edge of the hot tub or to the side of the pool. The Boom2 also has singular, handsome looks, and is right at home (in some of the colors) on the edge of the desk (where I have mine right now), on the kitchen bar, or in the middle of the cocktail table. The one place where it’s not the best is for more permanent installation – yes, the speaker can be powered and charged from MicroUSB, and has a line input port –  but they’re on the bottom of the unit. So if you want to use the Boom2 while plugged in, connected to the aux audio port, have access to the top power and pair buttons, and have it in the “correct” orientation for the side-firing stereo speakers (with treble on top and bass on bottom), then you’ll have to use the tripod screw mount to elevate the speaker up a bit. Kind of weird. But anyway, the Boom2 is great for portability.LikeThe Boom and Boom 2, when Doubled Up, each act as a stereo speaker individually, playing the same audio source. That makes sense, since the Boom and Boom 2 aren’t acoustically identical, so using each as one side of a stereo pair would be weird. I assume that if I were to double up two Boom 2’s, each would act as one side of a stereo pair. I can’t try this because I only own one Boom 2.The sound quality is a definite improvement form the OG Boom. It’s clearer, and gets considerably louder without distorting. I noticed that as the volume is turned up, the Boom2 seems to adjust the EQ accordingly, so nothing gets distorted, but the volume increases. I’m not a huge fan of this, but it works to consistently squeeze acceptable sounding audio out of a relatively small speaker. The only way to do this without a computer controlled EQ would be to just build a bigger speaker… which is not the point here.The pairing process of the Boom2 is a breeze. Additionally, it pairs quickly with my iPhone when I turn it on, and has a much longer Bluetooth range than the original Boom.The volume of the Boom2 is controlled directly from my iPhone. This is a small detail, but important. When I click the volume buttons on my phone, the actual volume of the Boom2 changes. This is in contrast with the other, less-good method of volume control, where I change the volume on my phone, giving the speaker a “hotter” output, but the actual volume setting of the device is independently controlled on the device. With the Boom2, these two volumes are one and the same, which I like a lot.I love squeezing the Boom2 and hearing it tell me how much battery I have left.For the size of this thing, the sound is really really fantastic. Sure it doesn’t have the best most ground shaking bass, but it sounds good in almost all regards. Music sounds smooth and pleasing. Podcasts are clear. And the speakerphone function works as it should. The FLAC files I listened to sounded good too – but no better than the compressed tracks I listened to on Spotify. I’d say if you’re looking for an audiophile grade speaker that will really make your super high end audio tracks shine, this is not the speaker. But for rocking out to Spotify tracks, this thing is really great.Don’t LikeIn “Double Up” mode, paired to my original UE Boom, I experienced a good amount of crackling and sound dropouts on the Boom 2. In this mode, it appeared that my phone was paired over bluetooth to the Boom, and then the Boom was paired to the Boom 2, sending audio data. I’m not sure if this is an issue with the Boom sending audio data to the Boom 2, the Boom 2 receiving the audio stream, or some other linking issue between the Original Boom and Boom 2 – but it was a pain to deal with. Of note, the speakers were about 15 feet from each other, and the Boom was 10 feet from my phone, in a normal living room, both with charged batteries, latest firmware.The color of my Boom 1 is orange rubber and a purple grille. How horribly ugly, and unfitting in any decor. I understand that it’s fun and youthful, but for my desk space, it sticks out like an eyesore. Luckily, Logitech does sell Boom 2 in more subdued colors.The motion activated functions – tap tap for track skipping etc – I don’t care. I never used these except to test that they work. And even when I was using the speaker in a more “dynamic” environment.. with friends rocking out in a parking lot before skiing – my phone was never so far away that I felt I needed to pick up the speaker to change the track. It just seems like an unnecessary feature.On a few tracks, the super low bass does get cutoff. I know this is because of its small size, but still, I really love that deep bass in XX’s “Fantasy”.I wish the audio in, charging ports were all on the top, so i could keep this thing standing up correctly while charging, connecting to external audio, etc. I know it’s easy enough to turn over, but it still seems upside down when I do that.Should you buy it?If you’re looking for a super versatile,  great sounding Bluetooth speaker that will sound great in normal rooms in your house, and have good chops for rocking small parties as well as your campsite, get this one. It’s totally usable in the widest range of situations I can imagine, and looks great doing it."
"UE-Wireless-Bluetooth-Waterproof-Shockproof","Stop shopping, just buy this speaker.","Style: Phantom Edition",5,"Put simply, it's the best sound I've heard from a bluetooth speaker. I've tried jazz, hip hop, folk, rock, country - doesn't matter, the range and clarity on this speaker is incredible. I don't have a single complaint. Good battery life, solid speaker, works all the time. Sometimes there's an issue pairing, but that is likely more with the iPad than it is with the speaker as it has happened to other bluetooth devices.The app could use some work, but you only need that if you are linking 2 of them. For just the speaker itself, I'd give it 6 stars if I could."
"UE-Wireless-Bluetooth-Waterproof-Shockproof","Great Rugged Speaker","Style: Yeti Edition",4,"Awesome speaker, super rugged and love that it's waterproof. The UE Roll is possibly better value depending what you're looking for. I highly recommend adding a small carabiner to the bottom ring so that you can hang it easily from things, like the UE Roll (A carabiner should really be included)ProsSuper loud for its size, great sound, easy connect, nice app, really long battery, rugged, waterproof. If you want a speaker for outdoor activities, and that you don't have to baby, this is it!Negatives (overall great, but here are a few areas for improvement)-Wish there was a dedicated next/play button. The tapping feature is very unreliable.-I love using it for phone calls, e.g. cooking in the kitchen and being able to talk to the person like they are there, but, the unit is giving lots of echo for the person on the other end, very annoying for them. The same thing happens with some bluetooth headphones, but not others. No serious help been given from UE.-Very hard to pair it with a UE Roll, since they each have their own apps - I imagine pairing it with another UE Boom 2 is easier, so this is a weird specific use case."
"UE-Wireless-Bluetooth-Waterproof-Shockproof","UE You nailed it with this one!!!","Style: Green Machine Edition",5,"OMG, this thing is amazing. I have taken it everywhere. The sound is amazing, to test it we cranked up AC/DC full blast and it was clear as a bell, no distortion. I have found that with any music I play is clear and it will rattle the windows with a good base line. I have amazon prime, so I have the amazon music and just download it to my phone and set the speaker by the pool, instant party. Easy 100 ft range, battery life is good as long as you don't crank it up all the way, if you do, it reduces the life to about half, but that's still 5-7 hrsMake sure to download the app and immediately update it, there are some neat features in it. I am seriously considering getting a couple more just to have around the house, so I can pipe music through out."
"UE-Wireless-Bluetooth-Waterproof-Shockproof","UE BOOM 2 Wireless Bluetooth Speaker gets the job done and more!","Style: Phantom Edition",5,"While I have not experimented on various bluetooth speakers like the UE BOOM 2, from my personal experience of using this device, I can easily say that my first experience with this device has been wonderful.The first thing I did was test it on an iPhone 6 and an HTC Android phone and pairing was quite easy.  Click on the button on top and go to your phone settings and it discovers the device and pair it via Bluetooth.  So easy!It's important to note that if you have multiple devices, it's best not to have them all on, if you want to switch one off to use the UE BOOM 2.But it's very easy to use and this thing is quite loud and sounds crystal clear.For my first time testing it over many hours non-stop, while I worked in the garage, this device was going strong for more than 10 hours (it supposedly has a 15 hour battery life) and I was running from my Mac to the garage, which is about 75 ft. and through a wall and still the signal was clear.  I was able to play Internet radio, YouTube and other media from my devices with no problem.It was easy to pause, skip through a song.  I also tested with my iPad, HP Slate and LG Android tablet with no problems.If there was any difficulty, the hardest part was trying to figure out how to open the case in which the speaker was stored.  But other than that, using this speaker right out of the case and also later recharging is quite simple (it comes with a 3 foot USB cord and adapter) and quick.The app for iOS and Android are similar and both are easy to use, pair multiple UE BOOM 2, set sound settings and more.And also updating the speaker was quite easy as well.While I didn't want to chance the waterproof test, everything about this speaker has worked wonderfully.The cylindrical style is quite stylish.JUDGMENT CALL:For its price and its crystal clear sound, the UE BOOM 2 Wireless Bluetooth Speaker is fantastic for those who want something simple and  inexpensive.  Up to 15 hours and ease of use is a plus.  While, I'm not an erudite on Bluetooth speakers, nor do I own anything else to compare it with, I can say that it's not bass heavy, it's more average.  It does deliver with 360 sound and is quite loud.I haven't had problems with Bluetooth pairing, nor did I have a problem nor have I had dropoffs.  The only thing is switching to various Bluetooth devices.  It's first come first serve of which device utilizes the UE BOOM 2 for pairing, but this is easily remedied by turning off a device or unpair it.For those considering it, it shows that the device works for iOS devices but it does work for Android devices as well.  Pretty much most things that have Bluetooth where you can pair it with this speaker.But for my experience alone, I absolutely am enjoying this UE BOOM 2 Wireless Bluetooth Speaker and can easily recommend it!"
"UE-Wireless-Bluetooth-Waterproof-Shockproof","Better than my other speakers","Style: Phantom Edition",5,"I have both the Boom 2 and the Bose Soundlink mini and find myself using this one the most. The sound is full and rich and can fill easily fill a room and, to my ears,the sound is as good as that which I get from my Bose Soundlink mini.  It also  holds a charge better than the Bose and therefore is better to take on a trip.. Also, the Bose is not the type of speaker to take outside or on a trip. In summary, I am really glad I purchased this speaker."
